reports/cross_validation_results.csv

Model,Accuracy,Precision,Recall,F1-score
Logistic Regression,80.51929761597523,65.80213918789771,55.21383205975542,60.02879955866468
Decision Tree,79.085364378347,62.889758389758384,51.79122879958711,56.708740118940185

reports/day8_cross_validation_findings.md

### Logistic Regression

Logistic Regression achieved an average accuracy of 80.52% and an F1-score of 60.03%. Its precision was 65.80%, while its recall was 55.21%.

### Decision Tree

The tuned Decision Tree achieved an average accuracy of 79.09% and an F1-score of 56.71%. Its precision was 62.89%, and its recall was 51.79%.